,id,name,intro to computer science,machine learning,web design,social psy,cognitive psy,industrial psy,intro to sociology,criminology,urban sociology,absence,sociology reviews,cs reviews,psy reviews
0,4003,Kristina Stone,41,70,43,77,26,89,76,69,87,8,"SOC 101 is excellent with Noorin Manji! Her syllabus was divided so anyone could get an A with minimum effort. While I do not think I will ever take a sociology course ever again, this course was the best 101 course to take as an elective. The textbook I did find was unnecessary until the final assignment.",go to office hours and practice,"Really easy, the course was made up of 3 online quizzes (most of the questions were easily googlable) and the final project could be done in one day."
1,4005,Elizabeth Lozano,48,43,68,100,58,95,73,70,86,1,.,"One of my least favourite courses. Although things were nicely organized, Racket was such an annoying language to use. The one tangible benefit I felt after using Racket was feeling more comfortable with recursion.",Surprisingly useful and as bird as expected. I now casually plug in Freud into daily small talk
2,4013,Samantha White,64,66,81,78,39,90,71,80,81,1,"Took during Spring 2022. Classic introductory course, online with recorded lectures. Covers many different sociology concepts at a basic level. Assignments weren't too difficult, but probably very boring for people who don't like sociology.","It starts with a very low pace but after midterm, it gets really fast and I cannot understand the content while reaching the end of term. Racket is restricted by so many things so I feel I lose the freedom of coding. The assignments are extremely hard after midterm, I spent a whole day on them but I can just solve the easiest one. The only positive impression that I have is that the design recipe weighs half so I pass this course successfully.",Had this class online. The content is interesting but the modules plus textbook readings are long. 2 quizzes are due every other week but I wouldn't recommend trying to do 2 quizzes in one week unless you have the time to do so. Making notes can easily take up to 2 days even if you don't work on anything else. The quizzes need a lot of theoretical application which can be difficult especially trying to understand the star wars based questions. The article summary and concept map assignment are pretty easy but the rubrics are kind of vague. Overall the course is interesting but quite heavy in terms of workload.
3,4021,Diana Smith,41,42,54,98,23,94,72,80,90,7,Took this course with Prof Manji. Very good breakdown of marks/assignments so that you can do well.,"Took this in 2018 with no programming experience ever. Started out pretty slow, but I didn't really pay attention and was severely behind. Went to a lot of office hours, but nonetheless caught up and did decently well. After taking more cs courses, racket really is a weird language.","Took online. Really fun and interesting concepts, and course modules were organized well. Quizzes were very ctrl-F-able. Written assignments and infographic took longer if you wanted a good mark, but overall a good interesting bird course."
4,4025,Amy Stanley,49,62,49,91,58,100,89,60,93,1,The content is what you would expect. Interesting if you like soc but probably boring if you don't. Assignments and lectures were straightforward.,"I loved everything about cs 115. Great instructors, fair assignments ( can get tricky but there's a huge amount of office hours to attend ), good engagement and interesting topics! It's seriously well structured and I would recommend it to anyone even with no background in coding.","Took the online version. Real interesting stuff if you actually read the weekly modules, but quizzes are totally control-F-able."
5,4027,Shawn Huffman,49,28,50,87,39,91,73,70,83,3,"Took this course with Ed and it was relatively easy. Theres weekly online quizzes but youre allowed unlimited tries to get 100%, one major group assignment that's spread out throughout the term, and one major paper at the end of the course. There is a textbook and I recommend getting it as well as going to class (although its not the end of the world if you miss a few classes since he uploads recorded lectures to learn)","I recommend finding a course with a language that is actually useful. Racket is dumb and never used anywhere. The majority of the course was quite easy, except a couple of concept checks that were RIDICULOUSLY HARD. i wish i had realized sooner that you get 10% of concept checks dropped from your grade. if you understand everything and are getting most things easily but you get stumped on one particular concept check, its probably not your fault and you should skip it, at least for now. the course was very well structured and predictable. expectations were clear and reasonable. it actually was designed to be a correspondence course, so it wasnt an online course that was rushed and slapped together for covid.","Not super fond of the course but some information is really interesting. The key to performing well is doing the lectures and readings, and keeping track of your quizzes."
6,4030,Ashley Lang DDS,83,53,45,72,76,93,72,91,87,1,"I took this course with the hope that it would be a light and fairly easy course to manage, and I was unfortunately wrong. The lecture material was more time consuming than expected because the prof wants you to do the readings and take notes, watch her lecture video, and then watch/listen to additional videos/podcasts that she links. The midterm and final (35% each) had some multiple choice, with a focus on short answer questions that could be fairly vague in my opinion. The assignment (30%) also had pretty vague instructions, and the TA's seemed to refuse to give anything above a 90% even if it was perfect. I wouldn't recommend taking this course if you're hoping it will be an easy mark booster, but its not bad.","I really enjoyed this course online, being co-taught by 4 professors. There were lots of office hours available to help and all of the TA's and Profs in office hours were helpful and kind. While the programming language used is not useful elsewhere, I think it is easy to understand and helped get the point of the course across. In my opinion, the point of this course is to teach you to think about solving problems and the process to go through, as you are not creating ground-breaking programs. As a student with no prior programming experience, I found this course both useful and easy if you kept up with the content and got help as soon as you needed it. The course was organized well, and the built in questions made sure you were on the right track. The assignments are fair based on what you learn. Go in with an open mind and keep up with the content and you should be just fine.",Heavy on readings but some of the readings and modules are pretty engaging.
7,4031,Laura James,65,61,38,77,17,87,78,69,90,8,"Not as birdy as I thought it would be, but pretty low maintenance course. Did not like the spread of marks this term (1 midterm, 1 final, 1 written assignment). For a class about sociology, it was a pretty anti-social class, barely interacted with the TAs, prof and students. Really enjoyed the content, as the subject is something really interesting to me. Textbook did the best job teaching cause the TAs gave very vague and minimal feedback.","math student who took this course since I had 0 prior programming experience. the course isn't horribly hard, but if you fall behind or don't understand one lesson, everything following will be super challenging. the course was mostly online completing modules, and my biggest criticism is that solutions for lessons are never posted after they are due which makes it super challenging to do the next week's module if you didn't understand/didnt know how to write a specific code for the week. the racket language used in this course is easy to follow but not very useful and isn't used anywhere. this makes it difficult to find help outside of cs115 profs/ta's/past cs115 students. the course is oddly paced, felt the super easy and simple first half of the course, and then gets unreasonably fast. didn't find any of the profs/ta's answers to questions posted on discussion boards useful at all. because the course was only offered online, I had to essentially had to teach the whole course to myself",Pretty interesting course but requires a lot of application-based knowledge that is not sufficiently provided in course materials
8,4035,Theresa Reeves,83,48,48,74,40,88,72,82,87,9,Easiest course I have taken in uni so far. I took it online in Fall 2021. The content was pretty straightforward. Anyone can easily get an 85+,"The only way to do bad in this course is by not managing ur time properly. This is a mistake I made when we had to work with modules. As long as u properly manage ur time and do assignments and concept checks well before the due date, you will have a great time in this course. Also try finding connections between assignments and try finding some real world applications of racket. Trust me Racket is very useful. The only criticism I have of this course is how the course is taught because it wasn't taught. (this is when I did online.) I had to understand all concepts by myself by basically reading texts. Although There was plenty of opportunity like office hours to ask for help, I only realized that towards the end of the term. Very unfortunate :(","Tested material was mainly focused on textbook content which wasn't taught in lectures, but ended up doing fairly well in the course"
9,4039,Andrea Powell,91,27,47,86,60,90,89,64,96,4,impossible to stay awake,"Can be difficult at times, but a very rewarding and fun course. Definitely made me like CS as a non-CS student! Start assignments early and definitely go to office hours. TAs and ISAs are very helpful.","Very science-based. 4 tests, each worth 10% and a final of 60%. With sona only being 2%. Ridiculous."
10,4041,Annette Hunter,62,72,39,88,40,100,68,64,82,9,Good class. No complaints. Did well. Assignments were straightforward.,"This course is taught in an archaic language that no one uses and no one understands. Instructors' explanations are irrelevant to actual questions and I got yelled during office hrs even though I stated that I need a little patience (I am disabled). Assignments and quizzes are unreasonably hard. I took to take this for bioinformatics option and decided to change my future career. Truly the worst in UW history. If you don't need this course, run.","Took this course online with Jennifer Stolz. Course was mostly quizzes. As long as you study the textbook, you'll do great."
11,4044,Samuel Wallace,62,52,44,94,25,96,75,60,93,8,"Pretty easy course, took online in Fall 21. Attending the weekly online lecture was optional, as recordings were posted the same day. Dr. Williams was very clear and the assignments/tutorial assignments were straightforward. Very harsh late penalty compared to other first year courses.","Not a bird course, although if you have background in programming it would not be difficult at all. Racket is somewhat useless but I learned some concepts that will be useful for other programming languages",Extremely easy if taken online
12,4047,Wendy Smith,40,30,46,92,36,81,82,60,86,1,"Boring class that I don't remember anything from. Prof seemed cool. If you're into sports, you'll like him. Have to buy textbook new each year, but it's nice to have all the readings in one little booklet.","I took this course online due to the COVID-19 pandemic, so my review is based on a remote, online learning experience. Overall, as someone who is not a CS student and who doesn't have a lot of background experience and knowledge in programming, it's a great introductory course to the language of Racket and the overall concepts that will be useful in later computer science courses. The Racket language itself is not a very ""useful"" language that you may or may not use in later CS courses and even in a job, but the foundation it provides is very valuable and will definitely make you think more mathematically at programming problems. The difficulty of this course starts to increase after the midterm exam, and it does get pretty tough nearing the end. I recommend starting the assignments as early as possible and attend as many office hours if you have any questions. The course staff are very responsive and do offer a good amount of help depending on your questions. Overall, I can't say much about the in-person learning experience, but this course was suited well for online learning and I enjoyed it.",Online offering is just quizzes each covering content from one chapter of the textbook.
13,4050,James Hardy,57,55,56,71,29,100,85,50,90,9,"If you skim the readings and pay attention to his lectures (which are not very difficult) it's an easy class. Some of the concepts repeat throughout the course, so once you get a feel of it, you'll be fine.","I found the online for this course to be fantastic personally. The EDx is clearly organized, and the content isn't too difficult, but provides a challenge. Can't speak to the in-person, but would definitely recommend the online. Beware though as this course is time consuming because of the amount of problems and assignments and shouldn't be mixed with a term that is already fairly difficult.",all online quizzes and 4% research participation bonus. heads up to SE kids this can count towards your science elective requirements
14,4051,Kimberly Smith,40,28,58,86,69,90,83,56,84,8,"I showed up to class, took good notes and was able to do really well in the course. If you pay attention and do the readings you'll do great. There was a paper, a midterm and a final exam.","This was joint taught by a bunch of profs in the Winter term and I think it was one of the most organized online courses I took. The content modules were all written but there was a bunch of integrated questions to check your understanding. The course is really centered on your ability to reach out for help when you need it since everything was asynchronous. I think my favourite part was how office hours were 1-on-1 and there were a lot of times available throughout the day. The only thing is that some of the nicer TAs had really long wait times lol. Overall super enjoyable though, just make sure to base your design recipe on their given examples or you will lose many marks","(Took online) 100% of our grade was made up of weekly quizzes that were pretty straightforward if you had done the readings. We even got a 4% SONA bonus on top of that, so if you find the topic interesting its easy to do really well. Had Fugelsang and Stolz"
15,4056,Anna Davis,75,28,55,71,48,87,69,55,90,8,"*Taken remotely due to COVID* Honestly didn't watch any of the lecture videos as the professor just read right off of them, as long as you do the readings and review the slides you'll be fine.","I think this course ran well online, the notes were very organized and easy enough to follow along and there is good support from most of the proffs and tas. The course may be a little fast for a complete cs beginner but the course has 400+ practice questions to help prepare for the weekly assignments",Took this course all online and it was extremely easy.
16,4097,Anthony Elliott,40,79,40,90,42,86,69,65,85,8,"This is an easy course with two quizzes, a position paper, and small weekly tutorial assignments (online). I didn't find it that useful because everything is pretty much all common sense and overlapped with other courses.","It's the worst course ever, online especially. They are least interested to teach. They just provided the content to read by ourselves. I wouldn't suggest anyone to take this course online.","I took the online course in spring 2021. Fairly light, one quiz a week with the lowest two dropped. The readings can be long but the lecture material is pretty short, both are tested on weekly quizzes. You can get a 4% mark boost with SONA credits so I would recommend doing that."
17,4098,Steven Long,98,21,40,89,26,87,88,97,93,1,Information is general and generic. It's a good filler course- just make sure not to forget to hand in tutorials or hand in things late. As long as you hand it in and it fits the criteria expect a high grade. You gotta read the readings cuz some Q's/assignments are specifically from them.,"Nice course that teaches you how to write simple code. But little annoying that you have to do Design Recipe (especially writing an explanation for codes). There is no loop in DrRacket so being able to understand recursion is important. All course contents are based on a website and you have to read everything and code something on that website. Pity that this course will not show many algorithms or data structures. So far I think those who can just play computer games (i.e. no coding experience but can easily type using the keyboard) can easily get 90+ in this course. If you have ever coded like C, python, java, pascal and so on, easy to get 95+. Idk why the easy rate goes so low but trust me, super easy course if you finish reading the material (okay reading part may be a little boring and CS 135 provide detailed intros which seem not wordy)","I took the online, fairly easy, just review the readings and lectures before quizzes and you can achieve an easy 80, and 90 if you put in a good effort. fairly light as well"
18,4114,Sherry Richard,89,22,53,71,53,97,65,54,86,9,"This course was unbearably easy. Most of the content is common sense. However, make sure you do the readings because there are questions that specifically correlate to them.","It was okay. All I can say is, do your work and submit assessments on time. Please don't procrastinate. That's what I did, and I live to regret it. This is because figuring out the solutions to each assessment problem takes time, and procrastinating doesn't help. So, submit early. Submit often. Submit. Submit.","Great course, interesting content. Pretty easy."
19,4123,Mary Davis,45,33,58,79,46,86,67,63,85,8,"This course is really boring in the sense that it is all common sense. There is not necessarily anything new that you will learn. However, one good thing is that there is tons of opportunity to be able to improve your grade (this is from a fall 2020, online perspective). The TAs are super kind and Wade, the instructor, will try his best to be flexible (ex: extending deadlines for assignments).","The end of the course became quite tough but otherwise this was pretty manageable. Excellent professors and ISA's who always take our feedback and concerns into consideration to make the course experience better, including having office hours very late at night and very early in the morning. The online platform is also excellent and fun to use.",Go to class before the first test so that you can get a sense of what the prof is like. Then you can skip all other lectures except the days that have tests. Read the textbook and it's an easy 75-80.
20,4136,Gina Wallace,72,23,41,85,61,100,67,91,89,9,Why wouldn't you like this mark booster,"The education quality is significantly impaired with no doubt since we are doing it online. Reviews before COVID was mostly positive. But after COVID-19, a lot of them are negative. I think that reflects something. Assignment were thrown into your face like you just have one class for the whole term. For me, I believe the material we learn and the assignment we need to do is inconsistent in terms of difficulty level. The gap between them is just huge. It often took me eight to twelve hours to finish the assignment. Don't take this if you are doing online.","This course really requires you to sit down with the material and go over it a few times before it starts to make sense. It's a dense one, and I think it's because cognitive science in general is pretty complicated."
21,4142,Dr. Angela Anderson MD,64,39,39,97,19,94,89,85,92,8,"The course content was useful and interesting at times. The tutorials were not useful and didn't connect to the lectures. The course was easy, with two non-cumulative tests, an annotated bibliography and position paper. The lectures were directly off of the readings.",so difficult for beginners,"This course was super easy, very simple concepts and not many overall. No final exam, just 4 noncumulative tests ~ every 2 weeks. Also had an opportunity to earn 4 bonus marks by participating in 4 credits worth of SONA studies. The course was a monday night class which sucked especially since the prof was very slow and repetitive. The textbook is also a required text since some of the tested material is exclusive to the textbook and not covered in lecture."
22,4143,Joseph Maldonado,74,41,71,97,41,90,69,65,88,2,Fun course to learn but not very useful,"Not an ""EASY"" course at all. Anyone commentating that is probably a Math/Eng student who is already familiar with coding through other courses. Since the midterm/exam is on paper, you have to be able to imagine what your code is going to be able to do without actually testing it like you do in your assignments! Speaking of assignment, they're bloody hard! No joke, it might take you an entire day to problem solve your way through them and that might not even be enough - incredibly frustrating course and not recommended unless you really want to study coding in the future. DR. Racket is not even applicable to most organizations. If you want to learn coding, just pick up something off Amazon or get a pdf through a friend - don't spend money here unless you're actually planning on continuing studies in CS.","I'd recommend doing the readings, and studying pretty hard for the exams. The course wasn't easy, but it wasn't super hard either. Overall, really fun and interesting!"
23,4154,Molly Allen,62,54,49,87,31,88,63,59,85,1,typical dry first yr class! It was mandatory so nothing too exciting,Must attend lectures if you're new to programming.,
24,4159,Christopher Johnson,41,35,77,81,30,92,65,57,82,8,"Honestly, it was a super fair course everything for midterms was straight from the slides. Look over the readings and get the main gist of it tho cuz they're kinda asked on the midterms. TA's for this course are probably the nicest you'll ever meet and will provide extra help or look over you papers for pointers and corrections. They're probably the best part of this course.",Pretty easy course overall! I stopped going to labs about three weeks in and still managed to get the bonus 3%. The assignments were relatively easy (with one or two exceptions).,"Took it online during my co-op term, it wasn't particularly hard or easy. There is a lot of content, as expected from a psych course, but really interesting nonetheless. I thought there wouldn't be an exam but there was but just keep studying and it should be fine. I didn't ever refer to the textbook and I was fine."
25,4162,Denise Foley,53,22,62,91,49,88,85,93,93,1,"Stupidly easy class. Never went and got a mark in the 90s. His lectures are straight out the readings. The tutorials however are nonsense. The mandatory attendance is a garbage rule, if you lose marks for not going that's one thing, but failing the whole component if you miss 2 is absurd. If you get a good TA though it's not terrible, mine let us skip the dumb assignments which was helpful, though I know some TAs made their class stay the whole 90 minutes even if there was nothing left to do.",Very easy course if you keep up with the material and do the assignments.,"The course was exactly what I was looking for - easy enough to understand as a non-psych student, but complex and engaging enough to be able to apply concepts. I seriously recommend the course to those interested in programming and machine learning. There are a lot of parallels being drawn between computers and the human brain, and a lot of emphasis on how cognitive science evolves as an applicable research field."
26,4163,Brandon Hall,55,42,80,95,47,96,88,53,80,4,wasn't my most favourite class.,"It's hard to motivate yourself to do the assignments when each is 2% or something, but it really is important to keep on top of it. They only get harder and arguably the only way to guarantee that you'll do well on the midterm (since you WILL be asked to write mini programs) I personally found the exam to be much harder than the midterm, so you really need to use the midterm as a grade booster.","I took this online. It is a super interesting course but there was a lot of memorizing (well, it is a psych course). But it was an amazing course!"
27,4169,John Quinn,57,38,67,89,32,92,78,73,97,8,"Class kinda sucked, readings were way too long. Some of the info was interesting and the assignments were easy. Tutorial was way more beneficial than the actual course content. Dr. Wilson was passionate about the class, but read from the slides directly (which were from the readings directly) which made going to class feel tedious.","Reviewing as a science major, this course was definitely the one that set me up with programming. Even though it was Dr. Racket, concepts were easy to follow. Be sure to go ask a lot of questions if you do not understand.","The course is basically the same as PSYCH101 but with a little more content relating to the brain. For winter 2017 there were only 4 term tests and we didn't end up going through all the content listed in the schedule. You don't need to attend lectures to pass the course, just read the textbook."
