28,4173,Hannah Brown,50,41,79,85,17,91,84,91,84,9,lmao why does this even exist,A good start in cs though Racket seems useless in the future study...,"I wanted so much to love this course. I truly did. But it's dry to an extent I haven't yet experienced in a psych course. The prof I had was probably a huge part of this, but the content really isn't much better. It's rote memorization of experiments that have little to no impact in the real world, or not one that was made clear at any rate. The textbook is written by the professor so you can bet on every lecture being a word for word reading of it. Hey, if you're looking for a course where you can read the textbook and nothing else to prepare for an exam, this one's for you."
29,4182,Sandra Logan,58,25,51,92,25,85,60,91,86,9,"Wilson never finishes his slides and he always goes off topics ( eg, talking about his job at Costco) . As a health studies student, I don't think this course as anything to do with health studies , however it is a fun class, because there isn't a lot of work .","Racket sucks, but the content of the course was easy enough to digest if you never did programming before. Seek help if you need it (early) and don't be afraid to talk to the TAs and profs!",Very dry material and not interesting. I have taken many psych courses and this was the worst so far. Very much need to know names and dates not how a theory works in the real world or how to apply it. Very dry.
30,4184,Jacob Harrison,75,69,59,93,72,86,83,89,83,2,"Very easy to do well. Exams were all MC and one research paper counted for your mark, as well as tutorial participation.","A great course, but a little strange if you're used to object oriented programming.","This class is straightforward and pretty easy to do well in, IF you enjoy the content! My lack of interest, coupled with the fact that it was an 830 class, made it extremely hard to pay attention and/or go to class. That being said, it wasn't overly difficult and had a small work load so if you have an genuine interest in the content then it's a pretty easy elective"
31,4193,Kenneth Shaffer,85,50,53,78,27,94,78,75,89,9,,This course was my favorite in first year. It's really fun. I enjoyed writing codes a lot.,If you aren't majoring/minoring in PSYCH than this course doesn't give you any useful information that PSYCH101 doesn't.
32,4195,Darren Russell,55,34,58,84,53,88,81,83,81,4,"Boring. Focused towards kin students, so as a health studies student, did not have anything to do with my studies. No flow to the course, random information on nothing. Useless topics being covered that were not engaging (prof didn't help either). Content is easy but midterms are tricky and TA mark hard for no reason, you would expect to be doing better than you actually are. Would not take this as an elective if you have the option, but this is required for all AHS students sadly, should really only be for those interested in sports therapy.","It you get stuck on an assignment, take a break and revisit later. Don't let assignments become a time-sink.","Took it online, was pretty dry, still easy though with brief reviews. Heavy final exam"
33,4198,Elizabeth Martin,82,24,55,85,61,86,86,51,90,7,Class was a little similar to HLTH 101. Midterm is easy just read all the readings at you'd do fine.,"well racket, it is ok","I took the online version of this course. If introductory psych didn't scare you away or it was a piece of cake for you, this course is easier. Theres no research paper assignment, so if you're not good at essays they gotchu. I suggest to skip the lectures if you dont have time and just read the textbook. The profs wrote the textbook so you should know it inside out. The lectures are the same as whats in the textbook but with a lot of important studies taken out."
34,4200,Jose Long,68,38,33,96,51,81,86,55,91,1,First comment!,i hate racket,gbleugrghghhhh annoying
35,4201,Destiny Perry,53,22,39,80,40,92,74,87,98,8,im horrible at math for all the honours science students that needs a math and doesnt actually need math 127 TAKE THIS!!!!!! its as good as it gets. 40% assignments 40% quizzes (both weekly) 20% final (ours was an open book asignment),Really easy. I had no previous coding experience and I picked it up the concepts super quickly. You have to go to class though. Slides are NOT enough,Interesting but can be boring or dry at some points. Exams are pretty easy and straight forward if you pay attention in class and take good notes.
36,4205,Joe Hinton,47,60,49,70,45,88,71,65,82,9,"The overall course material was okay, it is a review of grade 12 advanced functions and a little bit of calculus. The professor just rewrote the examples from the textbook so she was not very helpful. I learned from the textbook the entire course. So the textbook is really important to have.","CS 115's content wasn't too hard and is very accessible to first time coders. Be prepared to sometimes have to put in a good chunk of time for the weekly assignments, but the assignments help you out a lot with problem solving skills and becoming more comfortable with coding in general.",Awesome psych course. Content was interesting
37,4212,Jennifer Jones,61,43,65,96,56,89,84,52,91,4,Well... I can say that online courses are not for me. I would recommend anyone taking this class to go for the lecture course.,"SO easy, didn't pay attention in the lectures, just used course notes.",I took this online and it was really boring. It took me a lot effort to actually focus on the lecture videos. The content is really repetitive with the textbook
38,4219,Alex Fowler,75,32,70,82,33,93,80,67,84,9,"Easiest course ever if you've taken highschool calculus. The integration in this is also SUPER BASIC so if you havent learned integration and anti-derivatives before, like me, it is still SUPER easy. I literally got a 100% on my transcript in this course.","If you feel like you have sufficient Computer Science experience, go to CS 135 because it does challenge you more. This is a good introductory course to learn programming. Also, Racket needs some getting used to.","This (online) course is a total waste of time. It's a trivial overview of a bunch of cognitive psychology experiments that require zero critical thinking. It's all memorization. Maybe that's your thing, but it certainly wasn't mine."
39,4220,Tracy Hampton,72,45,48,80,41,81,76,66,89,8,You can pass the course without going provided you have the texbook,"Interesting, gg","If you're looking for a PSYCH course to take, this is a great second option after PSYCH 253 (Social Psychology)."
40,4224,Jeffrey Garcia,71,49,51,73,20,92,82,65,99,9,Basic calculus. Do your homework and study main concepts. Midterms were easy but final threw me off. Can easily get 85+ if you've taken high school calculus.,Take CS 135 or 145 if you have prior programming experience. The majority of this course is exceedingly easy if you already know programming basics. It may only possibly get difficult at the very end. The design recipe and templates are the hardest thing for the majority of the course.,Very interesting material; Great course! If you pay attention in lectures and read the text and you'll do great. :) (4 non-cumulative term tests)
41,4225,Tammy Wilson,59,67,75,91,45,90,73,97,91,1,Ugh math. But the concepts were easy to handle and once you got it the course moved pretty well.,Please be very careful about the design recipe (especially tests and examples),Interesting course that picks up on material learned in 101 (some of it in review). Course was quite easy.
42,4226,Amanda Pratt,44,61,43,71,39,82,81,70,87,9,Pretty easy class. The homework is necessary to do the weekly quizzes but it really helps you retain the stuff.,SO MUCH FUN OMG,Textbook course. Learned how to study from the professor.
43,4232,Tiffany Perez,46,55,35,77,27,88,82,76,92,9,"Course grade determined by three term tests and final exam. Term tests make you think you did well, but then you get your grade back and feel confused as to what you did wrong. Final exam is only written word questions with most of study guide on exam. Just memorize your definitions, and the exam will be easy.",Trivial course.,This course isn't super hard but it can be boring and dry at times... the textbook is not that recent and can be very dry... But sometimes it wasn't too bad and I did like some of the topics like Memory.
44,4236,Michael Walker,44,49,66,94,42,88,83,58,82,8,"I took it online during covid. The grade consisted of 3 quizzes and final exam (short answer questions and an essay). One of my favorite courses, very interesting content!",Pretty gentle introduction to programming,The setup for this course when I took it was just 4 non-cumulative tests in the year each worth 25%. You can learn almost everything just from reading the textbook and some parts are more interesting that others. There is the opportunity for 4% bonus for doing psych studies as well. This course was fairly interesting and quite easy to do well in.
45,4237,Tammy Stone MD,55,37,63,100,60,90,63,98,93,1,"This course was very informative & very interesting! It had 2 midterms, a paper and a final exam. Sometimes the content could be a bit graphic or disturbing but never overwhelmingly so.","It's pretty much an introduction to computer science concepts like recursion,BSTs and other abstract data types. It's VERY useful if you have no prior experience with programming.",Rote memorization.
46,4242,Russell Griffin,94,52,43,76,17,86,84,81,83,8,The four topics were interesting. Took it online and wrote the essay to avoid 100% final.,"do not take this as an elective unless coding/math is easy for you! there are a lot of concepts, impossible to teach yourself from the course notes because of how poorly organized they are. lectures are impossibly boring. My best friend tutors this class and I still justtttt scraped by. language is not super useful in life. many of my friends have taken this course because they heard it was easy and ended up failing.","Definitely read the book. The midterms are not pushovers, though with reasonable amount of studying it shouldn't be difficult."
47,4243,Marisa Richardson,71,39,59,98,30,85,65,90,84,9,keep up with the readings,"Was a nice way to learn recursion, which is essentially the purpose of this course. They also give a lot of free marks with a 3% lab bonus - DO THEM! That 3% can make a big difference in your mark.","I loved this course when I took it online in Fall 2020. I don't remember the name of my professor, but his modules were pretty well-made. The bit about the Milgram obedience experiments was especially well done. The LEARN quizzes were very, very reasonable and there was no final."
48,4245,Renee Krueger,55,41,73,89,32,88,81,61,94,8,"very interesting and not as intense as it might seem at first! exam was a piece of cake, don't be frightened by the 100% worth!! that being said, there was a mixup with the exam this year and i accidentally got the ""Option 1"" exam (ie for people who elected to write an essay and have the exam not be worth 100%) and a few questions were different, easier imo.",fuck i hate design recipe. your lose marks for nothing!,"to be honest, I'm not really sure what I learned in these past 4 months. this course is the embodiment of ""meh"", mostly just consisted of spending 5 minutes learning a concept and 45 minutes talking about studies that ""prove"" the concept. seriously, we probably covered over 100 studies in this course. the good news is; the quizzes were really easy to do well in and there was no final. the written components were graded more harshly but considering the SONA bonus and the weighting of the quizzes, it's not difficult to bounce back from that. most people take this course because it's required, and to those people, i would say don't be afraid of this course, it can just get really tedious and boring at times."
49,4246,Richard Herrera,63,43,77,88,72,89,68,67,87,2,I took it online. I didn't have to dedicate that much for it. WARNING- options are 100% exam or 30% paper/70% exam....Do the paper or else you will have to write a whole other section on the final. The final was easy I am just glad I didn't have to write another essay during the exam time like my peers who opted for the 100% exam did.,"I have never coded before so i opted to take this rather than CS135. This was really easy for me. I'm glad I took it though becuase it saved time so I can focus more on actual courses for my major (MATH145, PHYS121 etc). Don't expect to be able to code anything after this, especial since you use dr Raket. And the design recipes are a pain, my tip is put 20 test cases for everything.",I would say this is one of the harder core psych courses. So much reading involved I didn't like it. Lots of filler and fluff content that is not necessary. Lengthy multiple choice questions. Heavy course.
50,4248,Jacob Smith,46,27,61,81,70,83,83,54,88,9,Lots of cool examples and stories. Really interesting to listen to as well!,"Thanks to Keiko Katsuragawa, the prof who doesn't know how to type properly or speak English at a comprehensive level, I can't stand this easy CS course. Very prof dependent, but generally easy.","I really liked the content of this course, but if you're taking it online be prepared to commit at least 8 hours per week just to read each module + take notes. Some of them took me longer, it's kind of ridiculous. The content was interesting, but the amount of it is absolute overkill. I would have enjoyed the course a lot more if the content was presented in lecture format. At least it was easy to do well on the tests and assignments."
51,4250,Margaret Wright,66,25,73,81,38,84,86,65,82,8,"Great learning experience. It really brought my perspective on how many social factors can actually influence how an individual participates in sports. At first I was nervous on how the grade breakdown was, but moreover, it turned out to be one of those courses were you needed to put the effort into it. Spring 2017 is the last time this course is offered as all new AHS students will be enrolled in a first year sociology course known as AHS 107.",bring netflix.,"A lot of studies. I took the in-person before covid and it was difficult to remember all of the content. I would say this isn't as hard as PSYCH 261 in terms of the core 6 courses, but is definitely in the harder half."
52,4257,Laura Lang,55,38,81,95,32,99,88,74,89,1,"Laid back course, a couple readings, lots of discussions. Go to class its not that bad.","Joke course if you're a CS major who is taking it just to get a good CAV (to transfer from regular to co-op, that is).","Loved taking this class! The prof was understanding of us students as we are continuing to study amidst the pandemic and hard hit 3rd wave. As long as you put in effort, you will be awarded for it. Plus the content is very interesting and can be applied to your everyday life and understanding those around you. I strongly recommend this course. As every psych course it is content heavy, but it is worth it and it is easy to succeed."
53,4268,Douglas Nixon,96,59,61,85,30,88,77,96,90,4,Easy. No final. 3 reflections and 2 quizzes that are all 20% each. Very easy 80-90. Make sure you look over slides in lecture and write everything said in the rubric in the reflection,Elementary course in CS. Have fun!,"had this online, it was extremely easy. 50% group project (which really wasn't complicated), weekly quizzes that are straight from the modules. more experiment based than theory based, but very interesting nonetheless!"
54,4272,William Mathis,53,32,75,73,33,89,76,82,87,9,"Pretty boring class, however the discussions were engaging and interesting. Consisted of 2 midterms and 3 papers. BE SURE TO LOOK AT THE APA FORMATTING AND RUBRIC FOR THE PAPERS AS A BIG EMPHASIS IS PLACED ON IT.",Read the coursenote and only go to class for clicker questions,This course was super interesting and really fun. Make sure you do the readings! Exams were very experiment focused which made it a lot more interesting.
55,4282,Kim Reese,45,61,67,85,58,81,86,66,94,2,"Weekly readings are kinda interesting, but long. 3 reflection papers. 2 midterms. All worth 20%. Reflection papers heavily look at APA format, so make sure you know that. Midterms are very much reading-based so if you don't keep up with the readings, you will be screwed in the midterm. Lecture is vague and kinda boring, but engaging in discussion.",Really easy course. Especially if you have coded before. Assignments get a little harder at the end but both the midterm and finals were easy. The only thing I hated about this course was how annoying using Dr. Racket can be at times.,"Other than being a 3 hour lecture, it was very interesting and learned a lot. Most of it is memorizing and understanding each case."
56,4285,Veronica Franklin,86,22,71,98,38,85,80,57,88,9,Very easy. Makes you really examine some social problems from new perspectives but I did not find it useful. Very boring and going to lecture seemed to be optional.,People who like computer science will like this course.,interesting content and extremely relevant to real life
57,4287,Eric Price,58,21,46,94,32,82,84,89,90,8,"I hated this course! probably because of the new prof I dont know. Some of the topics were so dry and did not make sense, oh and the lecture slides.. nothing makes sense at all! the readings are unbelievably long and dry",great intro course for students with no background experience in CS and who don't plan on pursuing CS in the future. It can be prof dependent though.,Depends on who you have.
58,4288,Benjamin Frederick,50,56,66,77,59,89,79,61,85,8,"Not bad at all. There are weekly modules and no quizzes. However, there are weekly MOBIUS assignments and written assignments, and a total of 3 cumulative review submissions throughout the semester. Expect to work on topics such as inequalities, logarithms, probability theory, set theory, counting theory, and matrices. Those topics were new to me. Additionally, students must attend zoom sessions for participation marks (5%). As someone who struggled with math in high school, this course was a bit difficult but manageable. There is no final exam for the online course, but there is a final project worth 25%.",This course tests your logic,"Way more experiments needed to memorize than other PSYCH courses, less on actual concepts, experiments used to teach concepts."
59,4289,John Burke,53,77,43,75,61,93,81,81,93,2,"A Grade 10 / 11 algebra course. Not difficult at all, mostly just a refresher for students already familiar with algebra. If you are a beginner to algebra the content starts from the very beginning, so definitely a good course for students who didn't take maths in secondary school.","Entry-level cs course, no complicated stuff,easy assignments and midterms.",Social psych was one of the more interesting psych courses I took. It's an interesting look at lots of everyday phenomena.
60,4293,Debra Ramirez,94,39,68,71,34,95,68,52,84,6,"I took it online. Most of the time I didn’t even have to watch lecture videos, just scrolling through the slides was enough to do well in this class. The grade consists of 12 weekly assignments (your 2 worst marks are dropped), 2 midterms (they’re not timed, very similar to the weekly assignments) and final exam.",Easiest CS course this university has to offer. Basic math and you're good to go.,Skim the textbook! Otherwise pretty easy.
61,4298,Gregory Martinez,79,44,73,86,66,92,67,95,86,4,"If you have taken math in grade 12, this course is very easy. A good way to refresh your knowledge.",They teach Dr Racket in this course. No one ever uses Dr Racket. This is waste of time but can't skip it either.,tested mainly on experiments discussed in lecture and from the textbook - needed to know a lot of details. Only two midterms and a final (all were non cumulative)
62,4301,Melissa Kennedy,71,61,48,71,42,89,74,93,91,1,If you have any previous knowledge of the topics covered in the course (see course description) you will find the course incredibly boring and easy,For someone with no history in writing programs this was a very cool course. Lectures were difficult to pay attention to but I liked the overall skill set I came out of the course with. Also learned that coding can be very frustrating (you can easily get stuck at a road block for significant amounts of time) yet very rewarding (no better feeling than finally getting your program to run),Very easy if you stay caught up on readings and understand the lecture notes
63,4302,Collin Jones,72,57,60,78,34,94,77,61,84,9,This course sucked.,Good course for my first CS course.,"I had to take this course, I am not very interested in this subject, but it was an overall good course."
64,4309,Frederick Cruz,61,63,60,85,47,97,77,96,82,9,If in high school you took data management or even just 12U functions do not take this course. It is honestly not worth your time unless you're looking for an average booster as a student achieving an arts degree. You don't have to attend classes to understand what's going on and the textbook gives you most of the answers in the examples. If you've never heard of matrices before then that will be the only thing you struggle with.,"The course was relatively easy, but the midterm was setup poorly - the focus was not on core concepts but on the exactness of the stepping problems, which I don't think is useful at all.","Need to study well for it, it's not hard but not easy. I did enjoy the material, though."
65,4310,Anthony Stone,97,73,70,85,34,86,82,84,86,3,"Took in fall 2021, prof gave you textbook notes, all exams were open book. Got like a 90. Prof is super nice! only 3 assignments easy marks.",I had no programming experience before this class and it still wasn't too hard for the most part. A good elective. Some assignments were tricky but the exams were easy.,"The topics were interesting but the pace of this class was too fast for me. We had 3 midterms (she'd choose the best 2 marks out of the 3), a 5 page assignment and a cumulative final exam. Very overwhelming!"
66,4312,Dr. Karen Shea,51,68,37,72,36,90,68,75,81,7,Lots of theories and people to remember but very well explained. For tests you would have to study really hard and in depth beyond what was written. Discussion posts were based on textbook readings and specific theories so it makes you think a lot. The textbook info load was very heavy and remembering all the different theories and perspectives was hard too.,"Weekly assignments are not worth much, but are difficult. Weekly labs. 1 midterm, 1 final. Doing the labs will greatly help with the assignments. Asking questions to TAs and prof will help a lot.",Interesting material in general. Highly recommend to take it.
67,4318,Kevin Orozco,42,29,53,84,56,93,72,74,87,3,"Online courses were easy, not so demanding to get 80+",Pretty easy straight forward introductory CS course. People complain but scheme syntax but personally I don't mind prefix notation at all.,Almost all the concepts are things you can see in daily life. Helps give a new perspective when looking at things. Actual content is fairly easy.
68,4328,Michael Alvarado,74,62,64,82,16,90,74,53,84,8,"There are a lot of theories and concepts you need to know, and the tests will require you to actually have an understanding of them. It was difficult, but it gets you to think about life in a different way.","didn't like it, I was lucky I passed","Took online: Essay was worth less and bonus marks were easy to get but the quizzes were cheap and poorly designed, contained content not even in the lecture/text."
69,4331,Ryan Olson,56,70,81,93,30,81,90,94,85,3,"Do not skip readings since exams are very heavy on information from the readings. Exams are all multiple choice but many of them. Over all good course, a lot of information to take in quickly but readings help with that as well.","Awesome course, isn't too difficult like CS 135, but actually teaches you some good things. If you're looking for a not too difficult CS course, this is it right here. Make sure to leave a few hours aside to get through the assignments, they can be a bit tricky. Easy exams.",don't take it online
70,4341,William Ewing,85,51,50,86,19,94,83,66,94,9,"Straightforward course, the materials covered can be pretty dry though. Course consisted of a 35% midterm, group presentation worth 20%, and the cumulative final test worth 45%. Tests are basic material, majority of which is covered in textbook chapters so don't skimp out on the readings, especially since the final is cumulative.","Never taken anything even remotely related and this was super easy. Read the modules, take a couple hours each week to do assignments, easy enough midterm and final.",She asks specific questions on studies in the textbook so make sure you read it! We had to read a novel and critique it. Tests were difficult.
71,4352,Devon Nelson,81,53,47,77,52,88,88,83,82,2,"Read the text, know the concepts, easy if you read the text ahead and participate",Genuinely easy course...,A fun course! I loved the topics and it wasn't too much work.
72,4353,Anthony White,58,51,57,82,31,89,74,53,91,8,"Very interesting class, the final paper is long but the topics are so fascinating that it doesn't feel like work",easy course,Awesome course! Very easy course to do well in if you attend lectures.
